{
  "schema_version": "1.0.0",
  "artifact_id": "artifact_demo_001",
  "paper_id": "paper_demo_001",
  "artifact_kind": "vector_index",
  "lane": "green",
  "stage_status": "complete",
  "artifact_digest": "sha256:cccccccccccccccccccccccccccccccccccccccccccccccccccccccccccccccc",
  "created_at": "2026-01-01T00:40:00Z",
  "artifact_path": "fixtures/schema/artifacts/paper_demo_001.index",
  "vector_artifact_path": "fixtures/schema/artifacts/paper_demo_001.vectors"
}
